<?xml version = "1.0" encoding="UTF-8" standalone="no" ?>

<!DOCTYPE systeme SYSTEM "systeme.dtd">

<systeme>

	<!-- caractéristiques générale du système !-->
	<general>
		<nom>Solaire</nom>
		<URLimage>image_systeme</URLimage>
		<description>description_systeme</description>
	</general>

	<etoile>
		<nom>Soleil</nom>
		<masse>1989100</masse>
		<taille>6.96342</taille>
		<texture>texture_etoile</texture>
		<categorie>naine jaune</categorie>
		<temperature>0</temperature>
		<luminosite>0</luminosite>
		<description>Le Soleil est une étoile naine</description>	
	</etoile>
	
	<planete>
		<nom>Mercure</nom>
		<masse>0.3302</masse>
		<taille>0.024397</taille>
		<positionX>579.0992</positionX>
		<positionY>0</positionY>
		<positionZ>0</positionZ>
		<vitesseIniX>0</vitesseIniX>
		<vitesseIniY>0</vitesseIniY>
		<vitesseIniZ>47.36</vitesseIniZ>
		<texture>texture_mercure</texture>
		<categorie>tellurique</categorie>
		<composition>composition_mercure</composition>
		<description>description_mercure</description>
	</planete>
	
	<planete>
		<nom>Venus</nom>
		<masse>4.8685</masse>
		<taille>0.060518</taille>
		<positionX>1082.089</positionX>
		<positionY>0</positionY>
		<positionZ>0</positionZ>
		<vitesseIniX>0</vitesseIniX>
		<vitesseIniY>0</vitesseIniY>
		<vitesseIniZ>35.02</vitesseIniZ>
		<texture>none</texture>
		<categorie>tellurique</categorie>
		<composition>composition_venus</composition>
		<description>description_venus</description>		
	</planete>
	
	<planete>
		<nom>Terre</nom>
		<masse>5.9736</masse>
		<taille>0.06371</taille>
		<positionX>1495.979</positionX>
		<positionY>0</positionY>
		<positionZ>0</positionZ>
		<vitesseIniX>0</vitesseIniX>
		<vitesseIniY>0</vitesseIniY>
		<vitesseIniZ>29.783</vitesseIniZ>
		<texture>none</texture>
		<categorie>tellurique</categorie>
		<composition>composition_terre</composition>
		<description>description_terre</description>		
	</planete>
	
	<planete>
		<nom>Lune</nom>
		<masse>0.073477</masse>
		<taille>0.017367</taille>
		<positionX>1495.979</positionX>
		<positionY>0</positionY>
		<positionZ>3.84399</positionZ>
		<vitesseIniX>1.022</vitesseIniX>
		<vitesseIniY>0</vitesseIniY>
		<vitesseIniZ>29.783</vitesseIniZ>
		<texture>none</texture>
		<categorie>tellurique (satellite)</categorie>
		<composition>none</composition>
		<description>none</description>		
	</planete>
	
	<planete>
		<nom>Mars</nom>
		<masse>0.64185</masse>
		<taille>0.033895</taille>
		<positionX>2279.366</positionX>
		<positionY>0</positionY>
		<positionZ>0</positionZ>
		<vitesseIniX>0</vitesseIniX>
		<vitesseIniY>0</vitesseIniY>
		<vitesseIniZ>24.077</vitesseIniZ>
		<texture>none</texture>
		<categorie>tellurique</categorie>
		<composition>none</composition>
		<description>none</description>		
	</planete>
	
	<planete>
		<nom>Jupiter</nom>
		<masse>1898.6</masse>
		<taille>0.69911</taille>
		<positionX>7784.12</positionX>
		<positionY>0</positionY>
		<positionZ>0</positionZ>
		<vitesseIniX>0</vitesseIniX>
		<vitesseIniY>0</vitesseIniY>
		<vitesseIniZ>13.0572</vitesseIniZ>
		<texture>none</texture>
		<categorie>gazeuse</categorie>
		<composition>none</composition>
		<description>none</description>		
	</planete>
	
	<planete>
		<nom>Saturne</nom>
		<masse>568.46</masse>
		<taille>0.58232</taille>
		<positionX>14211.8</positionX>
		<positionY>0</positionY>
		<positionZ>0</positionZ>
		<vitesseIniX>0</vitesseIniX>
		<vitesseIniY>0</vitesseIniY>
		<vitesseIniZ>9.6446</vitesseIniZ>
		<texture>none</texture>
		<categorie>gazeuse</categorie>
		<composition>none</composition>
		<description>none</description>		
	</planete>
	
	<planete>
		<nom>Uranus</nom>
		<masse>86.810</masse>
		<taille>0.25361</taille>
		<positionX>28766.79</positionX>
		<positionY>0</positionY>
		<positionZ>0</positionZ>
		<vitesseIniX>0</vitesseIniX>
		<vitesseIniY>0</vitesseIniY>
		<vitesseIniZ>6.81</vitesseIniZ>
		<texture>none</texture>
		<categorie>géante glacée</categorie>
		<composition>none</composition>
		<description>none</description>
	</planete>
	
	<planete>
		<nom>Neptune</nom>
		<masse>102.43</masse>
		<taille>0.24622</taille>
		<positionX>45034.44</positionX>
		<positionY>0</positionY>
		<positionZ>0</positionZ>
		<vitesseIniX>0</vitesseIniX>
		<vitesseIniY>0</vitesseIniY>
		<vitesseIniZ>5.4317</vitesseIniZ>
		<texture>none</texture>
		<categorie>géante glacée</categorie>
		<composition>none</composition>
		<description>description_neptune</description>		
	</planete>
	
</systeme>
